code,name,credits,description,prerequisite,registration,termsOffered,gradeMode,additionalInformation
AREC 192,Orientation to Agricultural and Resource Econ  Credit,1 (0-0-1),Course Description: First year course in agricultural and resource economics and agricultural education. Information and skills necessary to succeed in majors and build an inclusive community in the Department of Agricultural and Resource Economics.,Prerequisite:  None. Restriction: Must be a: Undergraduate.,,,Grade Mode:  Traditional.,"Special Course Fee:  No.
",,Registration Information: This is a partial semester course. Sections may be offered: Online. Credit not allowed for both AREC 180A1 and AREC 192.Term Offered: Fall.
AREC 202,Agricultural and Resource Economics (GT-SS1)  ,3 (3-0-0),"Course Description: Introduction to decision-making by consumers, firms, and government and the resulting allocation of resources through markets.","Prerequisite:  MATH 117, may be taken concurrently or MATH 118 or MATH 124 or MATH 125 or MATH 126 or MATH 127 or MATH 141 or MATH 155 or MATH 159 or MATH 160.",,"Terms Offered: Fall, Spring.",Grade Mode:  Traditional.,Special Course Fee:  No.,"Additional Information:  Social & Behavioral Sciences 3C, Economic or Political Systems (GT-SS1).
",Registration Information: Sections may be offered: Online. Credit not allowed for both AREC 202 and ECON 202.
AREC 222,Economics of Food Systems  ,3 (3-0-0),"Course Description: Examine the food system using an economic lens. Review the physical, political, and structural context in which the US agricultural system is embedded. Use economic tools and concepts to analyze different components of the food system, as well as potential tradeoffs associated with different policy or other interventions.",Prerequisite:  None.Term Offered: Fall.,,,Grade Mode:  Traditional.,"Special Course Fee:  No.
",
AREC 224,Introduction to Agribusiness Entrepreneurship  Credit,1 (0-0-1),Course Description: Introductory exposure to entrepreneurship for agribusinesses through presentations by industry professionals.,"Prerequisite:  AREC 202, may be taken concurrently or ECON 202, may be taken concurrently.",,,Grade Mode:  Traditional.,"Special Course Fee:  No.
",,Registration Information: Required field trips. Sections may be offered: Online.Term Offered: Fall.
AREC 230,Agricultural Data Management and Analysis  ,3 (2-2-0),"Course Description: A survey of methods and tools to facilitate data gathering, analysis and visualization in a spreadsheet environment. Emphasis on data used in agricultural business and natural resource management.",Prerequisite:  None.,,,Grade Mode:  Traditional.,"Special Course Fee:  No.
",,Registration Information: Must register for lecture and laboratory.Term Offered: Spring.
AREC 240,Issues in Environmental Economics (GT-SS1)  ,3 (3-0-0),Course Description: Discussion and economic analysis of current environmental issues with special emphasis on the impact of economic growth.,Prerequisite:  None.,,"Terms Offered: Fall, Spring, Summer.",Grade Mode:  Traditional.,Special Course Fee:  No.,"Additional Information:  Social & Behavioral Sciences 3C, Economic or Political Systems (GT-SS1).
",Also Offered As:  ECON 240.,Registration Information: Sections may be offered: Online. Credit not allowed for both AREC 240 and ECON 240.
AREC 305,Agricultural and Resource Enterprise Analysis  ,3 (2-2-0),"Course Description: Use of records in agricultural and resource enterprise management; analytical methods, budgets, and planning techniques for improved decision making.",Prerequisite:  (CIS 120 or BUS 150 or CS 110) and (AREC 202 or ECON 202).,,"Terms Offered: Fall, Spring.",Grade Mode:  Traditional.,"Special Course Fee:  No.
",,Registration Information: Sections may be offered: Online. Must register for lecture and laboratory.
AREC 310,Agricultural Marketing  ,3 (3-0-0),"Course Description: Market structure, behavior, and performance including futures market and market games theory.",Prerequisite:  AREC 202 or ECON 202.,,"Terms Offered: Fall, Spring, Summer.","Grade Modes:  S/U within Student Option, Trad within Student Option.","Special Course Fee:  No.
",,Registration Information: Sections may be offered: Online.
AREC 311,Agricultural and Resource Product Marketing  ,3 (3-0-0),Course Description: Theory and practice of marketing-differentiated agricultural products and natural resource amenities with focus on strategies and market trends.,Prerequisite:  AREC 202 or ECON 202.Term Offered: Fall.,,,Grade Mode:  Traditional.,"Special Course Fee:  No.
",
AREC 325,Personnel Management in Agriculture  ,3 (3-0-0),"Course Description: Human resource issues for agribusiness firms. Managing employees, legal issues, negotiation methods, and benefits packages. Workplace professionalism.",Prerequisite:  AREC 202 or ECON 202. Restriction: .,,,Grade Mode:  Traditional.,"Special Course Fee:  No.
",,Registration Information: Sections may be offered: Online.Term Offered: Fall.
AREC 328,Small Agribusiness Management  ,3 (3-0-0),"Course Description: Apply business principles to small food enterprises, agribusinesses and cooperatives.",Prerequisite:  AREC 202 or ECON 202.,,"Terms Offered: Fall, Spring.",Grade Mode:  Traditional.,"Special Course Fee:  No.
",,Registration Information: Sections may be offered: Online.
AREC 330,Data-Driven Ag and Res Econ Decision Making  ,3 (2-2-0),"Course Description: Examine data used to inform decisions in many agribusiness and natural resource organizations. Preparation to use software (e.g., R and Tableau) to acquire, organize, and visualize data with a specific focus on informing business and policy decisions. Organized around real-world problems informed by industry partners and research projects.",Prerequisite:  (AREC 230) and (STAT 201 or STAT 204 or STAT 301 or STAT 307 or STAT 311 or STAT 315).,,,Grade Mode:  Traditional.,"Special Course Fee:  No.
",,Registration Information: Must register for lecture and laboratory.Term Offered: Spring.
AREC 335,Introduction to Econometrics  ,3 (3-0-0),Course Description: Estimating statistical regression models of economic relationships; treatment of special problems that may arise in analysis of economic data.,Prerequisite:  (ECON 204) and (STAT 201 or STAT 204 or STAT 301 or STAT 307 or STAT 311 or STAT 315) and (MATH 141 or MATH 155 or MATH 160).,,"Terms Offered: Fall, Spring.","Grade Modes:  S/U within Student Option, Trad within Student Option.","Special Course Fee:  No.
",,Also Offered As:  ECON 335.,Registration Information: Credit not allowed for both ECON 335 and AREC 335. Sections may be offered: Online.
AREC 340,Introduction-Economics of Natural Resources  ,3 (3-0-0),"Course Description: Concepts, theories, institutions; analytical methods for economic evaluation of alternative resource use patterns and land use plans.",Prerequisite:  AREC 202 or ECON 202.,,,"Grade Modes:  S/U within Student Option, Trad within Student Option.","Special Course Fee:  No.
",,Also Offered As:  ECON 340.,Registration Information: Sections may be offered: Online. Credit not allowed for both AREC 340 and ECON 340.Term Offered: Spring.
AREC 341,Environmental Economics  ,3 (3-0-0),Course Description: Economic theories and analytic frameworks are developed and applied to contemporary problems of the use and protection of the natural environment.,Prerequisite:  AREC 202 or ECON 202.,,,Grade Mode:  Traditional.,"Special Course Fee:  No.
",,Registration Information: Sections may be offered: Online.Term Offered: Fall.
AREC 342,"Water Law, Policy, and Institutions  ",3 (3-0-0),"Course Description: Legal water issues within the context of historical, social and economic development with emphasis on the southwestern United States.",Prerequisite:  None.,,,Grade Mode:  Traditional.,"Special Course Fee:  No.
",,Registration Information: Sections may be offered: Online.Term Offered: Spring.
AREC 346,Economics of Outdoor Recreation  ,3 (3-0-0),"Course Description: Application of benefit-cost framework to public planning for outdoor recreation. Topics include non-market valuation, projecting demand, cost of supplying recreation, and regional economic development.",Prerequisite:  AREC 202 or ECON 202.,,,Grade Mode:  Traditional.,"Special Course Fee:  No.
",,Also Offered As:  ECON 346.,Registration Information: Sections may be offered: Online. Credit not allowed for both AREC 346 and ECON 346.Term Offered: Fall.
AREC 375,Agricultural Law  ,3 (3-0-0),"Course Description: Laws, regulations, case decisions affecting ranching and farming in the Rocky Mountain area.",Prerequisite:  None. Restriction: Must be a: Junior.,,,"Grade Modes:  S/U within Student Option, Trad within Student Option.","Special Course Fee:  No.
",,Registration Information: Junior standing. Sections may be offered: Online.Term Offered: Fall.
AREC 405,Agricultural Production Management  ,3 (2-2-0),Course Description: Economic principles of agricultural production decisions with linear programming analysis of production choices and farm planning.,Prerequisite:  AREC 305.,,,"Grade Modes:  S/U within Student Option, Trad within Student Option.","Special Course Fee:  No.
",,Registration Information: Must register for lecture and laboratory.Term Offered: Spring.
AREC 408,Agricultural Finance  ,3 (3-0-0),"Course Description: Monetary affairs of agribusiness and agricultural production emphasizing credit institutions and procurement, investment, and management.",Prerequisite:  AREC 305.,,,Grade Mode:  Traditional.,"Special Course Fee:  No.
",,Registration Information: Sections may be offered: Online.Term Offered: Spring.
AREC 412,Agricultural Commodities Marketing  ,3 (3-0-0),Course Description: Agricultural marketing and agribusiness principles applied to current marketing problems relating to livestock and field and horticultural crops.,Prerequisite:  AREC 310.,,,Grade Mode:  Traditional.,"Special Course Fee:  Yes.
",,Registration Information: Sections may be offered: Online.Term Offered: Fall.
AREC 415,International Agricultural Trade  ,3 (3-0-0),Course Description: Agricultural trade patterns and institutions; trade theory with applications to agriculture. Current issues in agricultural trade.,Prerequisite:  AREC 310.,,,"Grade Modes:  S/U within Student Option, Trad within Student Option.","Special Course Fee:  No.
",,Registration Information: Sections may be offered: Online.Term Offered: Fall.
AREC 419,Commodity Market Trading Experience  ,3 (3-0-0),"Course Description: Firsthand experience engaging in futures and options trading in support of business activities. Analyze and trade in commodity markets as investment and risk management tools using economic information to develop trading plans and make use of fundamental and technical analysis to manage trades (real or synthetic). Work in teams, conduct independent research, communicate and justify decision making to other teams, instructors, and industry professionals.",Prerequisite:  AREC 310.,,,Grade Mode:  Traditional.,"Special Course Fee:  No.
",,Registration Information: May be taken up to two times for credit. A maximum of 6 credits may be taken from AREC 419 and AREC 480A2.Term Offered: Spring.
AREC 422,Food Supply Chain Management  ,3 (3-0-0),Course Description: Economic analysis of food supply chains studied through industry case studies.,Prerequisite:  AREC 311.Term Offered: Fall.,,,Grade Mode:  Traditional.,"Special Course Fee:  No.
",
AREC 428,Agricultural Business Management  ,3 (3-0-0),"Course Description: Economic analysis, organization, and management practices of agriculture and food industries studied through simulation, case study, computer labs.",Prerequisite:  (AREC 305) and (AREC 310 or AREC 311).,,"Terms Offered: Fall, Spring.","Grade Modes:  S/U within Student Option, Trad within Student Option.","Special Course Fee:  No.
",,Registration Information: Senior standing. Sections may be offered: Online.
AREC 440,Advanced Environmental and Resource Economics  ,3 (3-0-0),Course Description: Microeconomic techniques to rigorously explore economic decision-making and policy as they apply to environmental and natural resource problems.,Prerequisite:  (AREC 340 or ECON 340) and (AREC 341 and ECON 306).,,,Grade Mode:  Traditional.,"Special Course Fee:  No.
",,Registration Information: Sections may be offered: Online.Term Offered: Spring.
AREC 442,Water Resource Economics  ,3 (3-0-0),Course Description: An in-depth exploration of the role of economics in water resource planning.,"Prerequisite:  AREC 342 and ECON 306, may be taken concurrently.",,,Grade Mode:  Traditional.,"Special Course Fee:  No.
",,Registration Information: Credit not allowed for both AREC 442 and AREC 542.Term Offered: Spring.
AREC 444,Economics of Energy Resources  ,3 (3-0-0),"Course Description: Supply, consumption trends, and projected demand for alternative energy resources in domestic and world perspective; economics of public energy policies.",Prerequisite:  ECON 306.,,,Grade Mode:  Traditional.,"Special Course Fee:  No.
",,Also Offered As:  ECON 444.,"Registration Information: Junior standing. Sections may be offered: Online. Credit allowed for only one of the following: AREC 444, ECON 344, or ECON 444.Term Offered: Spring."
AREC 454,Real Estate Appraisal  ,3 (3-0-0),Course Description: Theoretical principles that underlie real estate appraisal methods. Procedures and practices used in real estate appraisal.,Prerequisite:  (AREC 202 or ECON 202) and (AREC 305 or REL 360).,,,Grade Mode:  Traditional.,"Special Course Fee:  No.
",,Also Offered As:  REL 454.,"Registration Information: Sections may be offered: Online. Credit allowed for only one of the following: AREC 453, AREC 454, REL 453, or REL 454.Term Offered: Spring."
AREC 460,Ag- and Resource-Based Economic Development  ,3 (3-0-0),"Course Description: Indicators, tools and approaches for agriculture- and natural resource-based economic development in resource dependent countries and communities.",Prerequisite:  ECON 306.,,,Grade Mode:  Traditional.,"Special Course Fee:  No.
",,Registration Information: Sections may be offered: Online.Term Offered: Spring.
AREC 461,A  Study Abroad--Italy: Economics of the Renaissance in Modern Italy  ,3 (0-0-3),"Course Description: The historical and current economics of agriculture and natural resources in Florence, Tuscany and Italy. Focus on (1) The role of culture, creativity and place in economic development; (2) Italian culture in general; (3) the economic and political history of Florence; and (4) the production, markets and economic importance of culture and natural resource-based industries in central Italy.",Prerequisite:  AREC 202 or ECON 202.,,,Grade Mode:  Traditional.,"Special Course Fee:  No.
",,Registration Information: Sophomore standing. This is a partial semester course. Required field trips. Credit not allowed for both AREC 461A and AREC 482B.Term Offered: Fall (even years).
AREC 461,B  Study Abroad--Italy: Food and Resource Economics  ,3 (0-0-3),"Course Description: In-depth investigation of the food and natural resource-based economy of Italy through an applied economics lens. Economics and policy are used to provide insight into the integration of Italian culture and its principal food and natural resource industries. A theoretical basis for different resource management systems are presented including various methods of cost–benefit analysis, utility theory, property rights structures, government institutions, and cultural and ethical considerations.",Prerequisite:  AREC 202 or ECON 202.,,,Grade Mode:  Traditional.,"Special Course Fee:  No.
",,Registration Information: Sophomore standing. This is a partial semester course. Credit not allowed for both AREC 461B and AREC 482A.Term Offered: Fall (even years).
AREC 478,Agricultural Policy  ,3 (3-0-0),"Course Description: Formulation, evaluation, and administration of public policies affecting the agricultural and natural resource industries in the United States.",Prerequisite:  AREC 202 or ECON 202 or AREC 240 or ECON 240.,,"Terms Offered: Fall, Spring.","Grade Modes:  S/U within Student Option, Trad within Student Option.","Special Course Fee:  No.
",,Registration Information: Sections may be offered: Online.
AREC 484,Supervised College Teaching  ,Var[1-5] (0-0-0),Course Description: ,Prerequisite:  None.,,"Terms Offered: Fall, Spring.",Grade Mode:  Instructor Option.,"Special Course Fee:  No.
",,Registration Information: Maximum of 10 credits allowed in course. A maximum of 10 combined credits for all 384 and 484 courses are counted towards graduation requirements.
AREC 487,Internship  ,Var[1-6] (0-0-0),Course Description: ,Prerequisite:  None.,,"Terms Offered: Fall, Spring, Summer.",Grade Mode:  Instructor Option.,"Special Course Fee:  No.
",,Registration Information: May be taken for a maximum of 6 credits. Sections may be offered: Online.
AREC 495,Independent Study  ,Var[1-6] (0-0-0),Course Description: ,Prerequisite:  None.,,"Terms Offered: Fall, Spring, Summer.",Grade Mode:  Instructor Option.,"Special Course Fee:  No.
",,Registration Information: May be taken for a maximum of 6 credits. Sections may be offered: Online.
AREC 496,Group Study  ,Var[1-18] (0-0-0),Course Description: ,Prerequisite:  None.,,"Terms Offered: Fall, Spring, Summer.",Grade Mode:  Instructor Option.,"Special Course Fee:  No.
",
AREC 505,Agricultural Production Economics  ,3 (3-0-0),"Course Description: Empirical applications of production economic theory for use of imputs and allocation of resources in agricultural, natural resource sectors.",Prerequisite:  (MATH 141) and (AREC 405 or ECON 306).Term Offered: Fall.,,,"Grade Modes:  S/U within Student Option, Trad within Student Option.","Special Course Fee:  No.
",
AREC 506,Applied Microeconomic Theory  ,3 (3-0-0),"Course Description: Introduction to mathematical models in modern microeconomics, including choices and demand, production and supply, and market structures and failures.",Prerequisite:  ECON 306.,,,Grade Mode:  Traditional.,"Special Course Fee:  No.
",,Also Offered As:  ECON 506.,Registration Information: Credit not allowed for both AREC 506 and ECON 506.Term Offered: Fall.
AREC 507,Applied Welfare and Policy Analysis  ,3 (3-0-0),"Course Description: How policies are crafted to effectively address social issues, especially for agriculture and the environment, and how they impact society.",Prerequisite:  ECON 306.Term Offered: Spring.,,,Grade Mode:  Traditional.,"Special Course Fee:  No.
",
AREC 508,Financial Management in Agriculture  ,2 (2-0-0),Course Description: Systematic approach to understanding and applying financial management in farm businesses.,Prerequisite:  (AREC 408 or FIN 305) and (ECON 306).Term Offered: Fall (odd years).,,,Grade Mode:  Traditional.,"Special Course Fee:  No.
",
AREC 510,Agricultural Product Marketing  ,3 (3-0-0),"Course Description: Marketing techniques, industrial organization/competition for agricultural products in US domestic, international trade, and developing country markets.",Prerequisite:  (AREC 310) and (AREC 335 or ECON 335).Term Offered: Fall.,,,"Grade Modes:  S/U within Student Option, Trad within Student Option.","Special Course Fee:  No.
",
AREC 511,Opportunities in the Agricultural Value Chain  ,2 (2-0-0),"Course Description: Explores the economics and business structure of operations within the food and agribusiness system, using readings, field trips and guest speakers.",Prerequisite:  None. Restriction: Must be a: Graduate.,,,Grade Mode:  Traditional.,"Special Course Fee:  No.
",,Registration Information: Graduate standing. Required field trips. Sections may be offered: Online.Term Offered: Fall.
AREC 512,Innovation in Agribusinesses  ,2 (2-0-0),Course Description: Core concepts of entrepreneurship within both private and social enterprises. General applications of innovation and entrepreneurship with particular emphasis on the industries that make up the agricultural and food system.,Prerequisite:  None. Restriction: Must be a: Graduate.,,,Grade Mode:  Traditional.,"Special Course Fee:  No.
",,Registration Information: Graduate standing. Sections may be offered: Online.Term Offered: Fall.
AREC 513,Idea Evaluation in Agricultural Value Chains  ,2 (2-0-0),"Course Description: Processes of identifying and evaluating a new idea, applying strategic and design-thinking principles and tools to explore pathways by which it could grow into a viable agribusiness.",Prerequisite:  None. Restriction: Must be a: Graduate.,,,Grade Mode:  Traditional.,"Special Course Fee:  No.
",,Registration Information: Graduate standing. Sections may be offered: Online.Term Offered: Fall.
AREC 514,Entrepreneurial Accounting and Finance  ,2 (2-0-0),Course Description: Foundational background in accounting and financial concepts and mastery of financial tools needed to start a new agribusiness.,Prerequisite:  None. Restriction: Must be a: Graduate.,,,Grade Mode:  Traditional.,"Special Course Fee:  No.
",,Registration Information: Graduate standing. Sections may be offered: Online.Term Offered: Fall.
AREC 515,Assessing Agricultural and Food Markets  ,2 (2-0-0),"Course Description: Foundational background regarding marketing concepts needed to evaluate the potential market for an agricultural or food product or service, using an economics framework.",Prerequisite:  None. Restriction: Must be a: Graduate.,,,Grade Mode:  Traditional.,"Special Course Fee:  No.
",,Registration Information: Graduate standing. Sections may be offered: Online.Term Offered: Fall.
AREC 516,Business Economics for the Entrepreneur  ,2 (2-0-0),"Course Description: Microeconomic framework that a potential entrepreneur can use to analyze business opportunities. Topics include components of cost and revenue and their relevance for new business ventures, determinants and measurement of consumer demand, and alternate forms of business organization and interaction.",Prerequisite:  AREC 202 or ECON 202. Restriction: Must be a: Graduate.,,,Grade Mode:  Traditional.,"Special Course Fee:  No.
",,Registration Information: Graduate standing. Sections may be offered: Online.Term Offered: Fall.
AREC 517,Entrepreneurial Identity and Team Formation  ,2 (1-2-0),"Course Description: Students explore their emergent identity as ""entrepreneur"", including their necessary interdependence on other members of a team when engaged in creative endeavors such as innovation or new business development in the agricultural space.",Prerequisite:  AREC 513. Restriction: Must be a: Graduate.,,,Grade Mode:  Traditional.,"Special Course Fee:  No.
",,Registration Information: Graduate standing. Must register for lecture and laboratory. Sections may be offered: Online.Term Offered: Spring.
AREC 518,Raising Capital in the Agricultural Sector  ,2 (2-0-0),Course Description: Methods to value a startup business and approaches to identifying sources of capital needed to launch and sustain the startup. Emphasis on unique challenges in and sources of raising capital in the agricultural sector.,Prerequisite:  AREC 512 and AREC 514. Restriction: Must be a: Graduate.,,,Grade Mode:  Traditional.,"Special Course Fee:  No.
",,Registration Information: Graduate standing. Sections may be offered: Online.Term Offered: Spring.
AREC 519,A  New Venture Communication,Interpersonal Interactions  Credit,"Course Description: Communicating in the workplace, both orally and in written form. Development of a succinct business proposal.","Prerequisite:  AREC 517, may be taken concurrently. Restriction: Must be a: Graduate.",,,Grade Mode:  Traditional.,"Special Course Fee:  No.
",,Registration Information: Graduate standing. This is a partial semester course. Sections may be offered: Online.Term Offered: Spring.
AREC 519,B  New Venture Communication,Making the Pitch  Credit,Course Description: Emphasis on oral communication when trying to sell a business idea to potential investors. Development of tailored presentations to target audience within moments of opportunity.,Prerequisite:  AREC 519A. Restriction: Must be a: Graduate.,,,Grade Mode:  Traditional.,"Special Course Fee:  No.
",,Registration Information: Graduate standing. Sections may be offered: Online.Term Offered: Fall.
AREC 520,Intellectual Property in Food and Agriculture  ,2 (2-0-0),"Course Description: Explores the critical role that intellectual property plays in commercial activities within the knowledge economy. Emphasis on strategic management of technology through patents and other control mechanisms, thereby allowing startups to survive and thrive in the knowledge economy with special attention to property developed in the agricultural and food systems.",Prerequisite:  AREC 518 and BUS 660. Restriction: Must be a: Graduate.,,,Grade Mode:  Traditional.,"Special Course Fee:  No.
",,Registration Information: Graduate standing. Sections may be offered: Online.Term Offered: Summer.
AREC 521,New Food Product Development  ,2 (2-0-0),"Course Description: An overview of the food product development process. Topics include strategies, marketing perspectives, quality controls and supply chains in the food system.",Prerequisite:  AREC 515. Restriction: Must be a: Graduate.,,,Grade Mode:  Traditional.,"Special Course Fee:  No.
",,Registration Information: Graduate standing. Sections may be offered: Online.Term Offered: Summer.
